{
  "name": "jsonschema",
  "abstract": "JSON Schema validation functions for PostgreSQL",
  "description": "The jsonschema extension provides JSON Schema validation functions supporting drafts 2020-12, 2019-09, 7, 6, and 4",
  "version": "0.1.1",
  "maintainers": [
    {
      "name": "David E. Wheeler",
      "email": "david@justatheory.com"
    },
    {
      "name": "Tembo",
      "email": "admin+pgxn@tembo.io"
    }
  ],
  "license": "MIT",
  "contents": {
    "extensions": {
      "jsonschema": {
        "abstract": "JSON Schema validation functions for PostgreSQL",
        "doc": "doc/jsonschema.md",
        "sql": "target/release/**/jsonschema--0.1.1.sql",
        "control": "target/release/**/jsonschema.control",
        "x_commit_hash": "4ba6b23"
      }
    },
    "modules": {
      "libjsonschema": {
        "type": "extension",
        "lib": "target/release/libjsonschema"
      }
    }
  },
  "dependencies": {
    "pipeline": "pgrx",
    "postgres": {
      "version": "12.0"
    }
  },
  "resources": {
    "issues": "https://github.com/tembo-io/pg-jsonschema-boon/issues/",
    "repository": "https://github.com/tembo-io/pg-jsonschema-boon/",
    "badges": [
      {
        "alt": "‚öñÔ∏è MIT License",
        "src": "https://img.shields.io/badge/License-MIT-blue.svg",
        "url": "https://github.com/tembo-io/pg-jsonschema-boon/blob/main/LICENSE.md"
      },
      {
        "alt": "üß™ Lint and Test",
        "src": "https://github.com/tembo-io/pg-jsonschema-boon/actions/workflows/lint-and-test.yml/badge.svg",
        "url": "https://github.com/tembo-io/pg-jsonschema-boon/actions/workflows/lint-and-test.yml"
      },
      {
        "alt": "üìä Code Coverage",
        "src": "https://codecov.io/gh/tembo-io/pg-jsonschema-boon/graph/badge.svg",
        "url": "https://codecov.io/gh/tembo-io/pg-jsonschema-boon"
      }
    ]
  },
  "producer": "David E. Wheeler",
  "meta-spec": {
    "version": "2.0.0",
    "url": "https://rfcs.pgxn.org/0003-meta-spec-v2.html"
  },
  "classifications": {
    "categories": ["Data and Transformations"],
    "tags": [
      "jsonschema",
      "validation",
      "json",
      "schema",
      "constraint",
      "pgrx",
      "rust"
    ]
  },
  "artifacts": [
    {
      "type": "source",
      "url": "https://github.com/tembo-io/pg-jsonschema-boon/releases/download/v0.1.1/jsonschema-0.1.1.zip",
      "sha512": "cfd9447575acb764aba6eb01c9c8ce75a5975c3be103d330a6a22b1a5ff85af8392fd348569b0eefd2d033232c0a5bffead3309d9c39759788889b51d79dd6ef"
    }
  ]
}
